{
  "schema_version": 1,
  "context_id": "fictional-lab",
  "focal_uri": "workctx://fictional-lab/task/TASK-2026-014",
  "source_updated_at": "2026-07-30T19:00:00Z",
  "source_fingerprint": "aaaaaaaaaaaaaaaaaaaaaaaaaaaaaaaaaaaaaaaaaaaaaaaaaaaaaaaaaaaaaaaa",
  "query": null,
  "include_history": false,
  "include_architecture": false,
  "sections": {
    "focal_entity": {
      "items": [
        {
          "id": "TASK-2026-014",
          "kind": "task",
          "uri": "workctx://fictional-lab/task/TASK-2026-014",
          "title": "Review the fictional authentication migration",
          "summary": "",
          "data": {},
          "rank": null
        }
      ],
      "omitted_count": 0
    },
    "claims_and_status_history": {
      "items": [],
      "omitted_count": 1
    },
    "direct_relationships": {
      "items": [],
      "omitted_count": 0
    },
    "source_observations": {
      "items": [],
      "omitted_count": 1
    },
    "related_tasks_and_dependencies": {
      "items": [],
      "omitted_count": 0
    },
    "people_and_interactions": {
      "items": [],
      "omitted_count": 0
    },
    "decisions_risks_and_questions": {
      "items": [],
      "omitted_count": 0
    },
    "contradictory_or_superseding_evidence": {
      "items": [],
      "omitted_count": 0
    },
    "architecture_entities": {
      "items": [],
      "omitted_count": 1
    },
    "budget_and_truncation": {
      "requested_units": 16,
      "used_units": 48,
      "minimum_units": 48,
      "unit": "approx_tokens_chars_div_4",
      "truncated": true,
      "within_budget": false,
      "over_budget_by": 32,
      "omitted_count": 3,
      "omitted_items": [
        {
          "section": "claims_and_status_history",
          "item_id": "CLM-2026-00002",
          "units": 18,
          "reason": "budget"
        },
        {
          "section": "source_observations",
          "item_id": "EVD-20260730-auth-review-01#OBS-001",
          "units": 22,
          "reason": "budget"
        },
        {
          "section": "architecture_entities",
          "item_id": "SYS-identity-service",
          "units": 16,
          "reason": "budget"
        }
      ]
    }
  }
}
